{
  "$schema": "vocalia-catalog-fleet-v1",
  "tenant_id": "loc_auto_casa",
  "last_sync": "2026-02-03T10:00:00Z",
  "source": "custom",
  "vehicles": [
    {
      "id": "VEH-001",
      "type": "berline",
      "brand": "Renault",
      "model": "Megane",
      "year": 2024,
      "price_per_day": 350,
      "price_per_week": 2100,
      "currency": "MAD",
      "fuel": "essence",
      "transmission": "automatique",
      "seats": 5,
      "doors": 4,
      "luggage_capacity": 3,
      "air_conditioning": true,
      "gps": true,
      "available_from": "2026-02-05",
      "available_to": "2026-02-28",
      "pickup_location_ids": ["LOC-01", "LOC-02"],
      "mileage_limit": 200,
      "deposit": 3000,
      "insurance_included": true,
      "voice_description": "Renault Megane 2024 automatique, 5 places, climatisée, GPS inclus, à 350 dirhams par jour, disponible du 5 au 28 février"
    },
    {
      "id": "VEH-002",
      "type": "citadine",
      "brand": "Dacia",
      "model": "Sandero",
      "year": 2023,
      "price_per_day": 200,
      "price_per_week": 1200,
      "currency": "MAD",
      "fuel": "essence",
      "transmission": "manuelle",
      "seats": 5,
      "doors": 4,
      "luggage_capacity": 2,
      "air_conditioning": true,
      "gps": false,
      "available_from": "2026-02-03",
      "available_to": "2026-03-15",
      "pickup_location_ids": ["LOC-01", "LOC-02", "LOC-03"],
      "mileage_limit": 0,
      "deposit": 2000,
      "insurance_included": true,
      "voice_description": "Dacia Sandero 2023 manuelle, 5 places, à 200 dirhams par jour, kilométrage illimité"
    },
    {
      "id": "VEH-003",
      "type": "suv",
      "brand": "Peugeot",
      "model": "3008",
      "year": 2024,
      "price_per_day": 550,
      "price_per_week": 3300,
      "currency": "MAD",
      "fuel": "diesel",
      "transmission": "automatique",
      "seats": 5,
      "doors": 5,
      "luggage_capacity": 4,
      "air_conditioning": true,
      "gps": true,
      "available_from": "2026-02-10",
      "available_to": "2026-02-25",
      "pickup_location_ids": ["LOC-01"],
      "mileage_limit": 300,
      "deposit": 5000,
      "insurance_included": true,
      "voice_description": "Peugeot 3008 SUV 2024 automatique diesel, 5 places, à 550 dirhams par jour, disponible du 10 au 25 février"
    },
    {
      "id": "VEH-004",
      "type": "utilitaire",
      "brand": "Renault",
      "model": "Kangoo",
      "year": 2022,
      "price_per_day": 400,
      "price_per_week": 2400,
      "currency": "MAD",
      "fuel": "diesel",
      "transmission": "manuelle",
      "seats": 2,
      "doors": 4,
      "luggage_capacity": 8,
      "air_conditioning": true,
      "gps": false,
      "available_from": "2026-02-03",
      "available_to": "2026-03-01",
      "pickup_location_ids": ["LOC-02"],
      "mileage_limit": 150,
      "deposit": 3000,
      "insurance_included": true,
      "voice_description": "Renault Kangoo utilitaire 2022 diesel, 2 places avec grand volume de chargement, à 400 dirhams par jour"
    },
    {
      "id": "VEH-005",
      "type": "luxe",
      "brand": "Mercedes",
      "model": "Classe E",
      "year": 2024,
      "price_per_day": 1200,
      "price_per_week": 7000,
      "currency": "MAD",
      "fuel": "hybride",
      "transmission": "automatique",
      "seats": 5,
      "doors": 4,
      "luggage_capacity": 3,
      "air_conditioning": true,
      "gps": true,
      "available_from": "2026-02-15",
      "available_to": "2026-02-28",
      "pickup_location_ids": ["LOC-01"],
      "mileage_limit": 200,
      "deposit": 10000,
      "insurance_included": true,
      "voice_description": "Mercedes Classe E hybride 2024, luxe automatique, à 1200 dirhams par jour, disponible à partir du 15 février"
    }
  ],
  "pickup_locations": [
    {
      "id": "LOC-01",
      "name": "Aéroport Mohammed V",
      "address": "Terminal 1, Aéroport Mohammed V",
      "city": "Casablanca",
      "opening_hours": "24h/24",
      "phone": "+212522000001"
    },
    {
      "id": "LOC-02",
      "name": "Gare Casa Voyageurs",
      "address": "Place de la Gare, Casa Voyageurs",
      "city": "Casablanca",
      "opening_hours": "06:00-22:00",
      "phone": "+212522000002"
    },
    {
      "id": "LOC-03",
      "name": "Agence Maarif",
      "address": "123 Boulevard Zerktouni, Maarif",
      "city": "Casablanca",
      "opening_hours": "08:00-19:00",
      "phone": "+212522000003"
    }
  ]
}
